{
  "sourceId": "erpdb-supplier-materials",
  "version": "1.1.0",
  "sourceType": "postgresql",
  "profileRef": "SMProfile-Supplier",
  "connection": {
    "host": "${ERP_DB_HOST}",
    "port": "${ERP_DB_PORT}",
    "database": "erpdb",
    "schema": "llm_test_v3",
    "table": "einkaufsinfosatz"
  },
  "columnMappings": [
    {
      "column": "lieferant_id",
      "smAttribute": "supplier_id",
      "isId": true
    },
    {
      "column": "teil_id",
      "smAttribute": "material_id"
    },
    {
      "column": "preis",
      "smAttribute": "price"
    },
    {
      "column": "lieferzeit_tage",
      "smAttribute": "lead_time_days"
    },
    {
      "column": "mindestbestellmenge",
      "smAttribute": "min_order_qty"
    },
    {
      "column": "ist_hauptlieferant",
      "smAttribute": "is_primary"
    },
    {
      "column": "aktiv",
      "smAttribute": "active"
    }
  ],
  "filter": "aktiv = true",
  "edges": [
    {
      "type": "DELIVERS",
      "fkColumn": "teil_id",
      "targetIdProp": "article_no"
    }
  ]
}
