{
  "sourceId": "erpdb-customers",
  "version": "1.0.0",
  "sourceType": "postgresql",
  "profileRef": "SMProfile-Customer",
  "connection": {
    "host": "${ERP_DB_HOST}",
    "port": "${ERP_DB_PORT}",
    "database": "erpdb",
    "schema": "llm_test_v3",
    "table": "kunden"
  },
  "columnMappings": [
    {
      "column": "kunde_id",
      "smAttribute": "customer_id",
      "isId": true
    },
    {
      "column": "name",
      "smAttribute": "name"
    },
    {
      "column": "ort",
      "smAttribute": "city"
    },
    {
      "column": "land",
      "smAttribute": "country"
    },
    {
      "column": "email",
      "smAttribute": "email"
    }
  ],
  "filter": null,
  "edges": []
}
