{
  "sourceId": "sim-v5-wms-quants",
  "version": "1.0.0",
  "sourceType": "rest",
  "syncType": "polling",
  "profileRef": "SMProfile-Quant",
  "transport": [
    "nats"
  ],
  "connection": {
    "baseUrl": "http://192.168.178.154:38224",
    "path": "/api/wms/quants",
    "method": "GET",
    "auth": null,
    "timeoutMs": 10000
  },
  "response": {
    "format": "json",
    "rootPath": "$.rows",
    "idProperty": "quant_no"
  },
  "polling": {
    "changeDetection": "full_refresh",
    "intervalMs": 60000,
    "batchSize": 1000
  },
  "columnMappings": [
    {
      "column": "quant_id",
      "smAttribute": "quant_no",
      "isId": true
    },
    {
      "column": "artikel_nr",
      "smAttribute": "article_ref"
    },
    {
      "column": "lager_nr",
      "smAttribute": "warehouse"
    },
    {
      "column": "lagerplatz_id",
      "smAttribute": "storage_location"
    },
    {
      "column": "menge",
      "smAttribute": "quantity"
    },
    {
      "column": "charge_nr",
      "smAttribute": "lot"
    },
    {
      "column": "gesperrt",
      "smAttribute": "blocked"
    },
    {
      "column": "aktualisiert_am",
      "smAttribute": "updated_at"
    }
  ],
  "edges": [
    {
      "type": "FOR_ARTICLE",
      "fkColumn": "artikel_nr",
      "targetIdProp": "article_no"
    },
    {
      "type": "AT_LOCATION",
      "fkColumn": "lagerplatz_id",
      "targetIdProp": "storage_location_id"
    }
  ],
  "description": "next/ v4 — WMS-Bestaende (Quant) ausgerichtet auf SMProfile-Quant (next/). Liefert ueber den it-edge/BUSINESS-Pfad einen business.*-Stream (entity_type=quant), geschluesselt auf quant_no. article_ref + blocked (gesperrt) + quantity (menge) treiben die Cross-Domain-Deviation material_unavailable: aktive OperationsResponse braucht article_ref X, sum(freier WMS-Bestand X | blocked==0) == 0 -> multi_source-Discrepancy. full_refresh: liefert die aktuelle Bestandsliste je Poll (kein Timestamp-Diff)."
}
